{
  "$schema": "../../../spec/schemas/resolved-token-bundle.schema.json",
  "schema": "neosmartui/resolved-token-bundle@1",
  "theme": "Rivet Dark",
  "flavor": "flavor.rivet",
  "scope": [
    "core.button",
    "core.checkbox",
    "core.input",
    "core.radio",
    "core.switch",
    "core.tabs",
    "core.textarea",
    "core.select",
    "core.card",
    "core.badge",
    "core.alert",
    "core.field",
    "core.breadcrumb",
    "core.pagination",
    "core.segmented-control",
    "core.tooltip",
    "core.combobox",
    "core.accordion",
    "core.label",
    "core.button-group",
    "core.input-group",
    "core.number-field",
    "core.toggle",
    "core.toggle-group",
    "core.slider",
    "core.progress",
    "core.spinner",
    "core.separator",
    "core.input-otp",
    "core.color-picker",
    "core.time-picker",
    "core.multi-select",
    "core.file-upload",
    "core.calendar",
    "core.date-picker",
    "core.dialog",
    "core.alert-dialog",
    "core.drawer",
    "core.popover",
    "core.hover-card",
    "core.dropdown-menu",
    "core.context-menu",
    "core.menubar",
    "core.navigation-menu",
    "core.toast",
    "core.table",
    "core.data-grid",
    "core.item",
    "core.list"
  ],
  "values": [
    {
      "id": "color.surface.interactive",
      "type": "color",
      "value": "#18171c"
    },
    {
      "id": "color.surface.panel",
      "type": "color",
      "value": "#232129"
    },
    {
      "id": "color.content.primary",
      "type": "color",
      "value": "#f6f3fa"
    },
    {
      "id": "color.content.secondary",
      "type": "color",
      "value": "#c9c3d1"
    },
    {
      "id": "color.content.inverse",
      "type": "color",
      "value": "#211c2b"
    },
    {
      "id": "color.border.default",
      "type": "color",
      "value": "#aaa4b2"
    },
    {
      "id": "color.border.strong",
      "type": "color",
      "value": "#f5f1fa"
    },
    {
      "id": "color.action.primary.surface",
      "type": "color",
      "value": "#c7b5f2"
    },
    {
      "id": "color.action.primary.content",
      "type": "color",
      "value": "#211c2b"
    },
    {
      "id": "color.state.success",
      "type": "color",
      "value": "#2e7644"
    },
    {
      "id": "color.state.warning",
      "type": "color",
      "value": "#5e7008"
    },
    {
      "id": "color.state.error",
      "type": "color",
      "value": "#ef8a84"
    },
    {
      "id": "color.state.info",
      "type": "color",
      "value": "#764dd6"
    },
    {
      "id": "border.control.width",
      "type": "dimension",
      "value": "3px"
    },
    {
      "id": "border.surface.width",
      "type": "dimension",
      "value": "3px"
    },
    {
      "id": "border.annotation.width",
      "type": "dimension",
      "value": "2px"
    },
    {
      "id": "radius.control",
      "type": "dimension",
      "value": "6px"
    },
    {
      "id": "radius.surface",
      "type": "dimension",
      "value": "6px"
    },
    {
      "id": "radius.annotation",
      "type": "dimension",
      "value": "999px"
    },
    {
      "id": "space.control.inline",
      "type": "dimension",
      "value": "1rem"
    },
    {
      "id": "space.control.block",
      "type": "dimension",
      "value": "0.75rem"
    },
    {
      "id": "space.field.gap",
      "type": "dimension",
      "value": "clamp(0.5rem, 0.44rem + 0.18vw, 0.6875rem)"
    },
    {
      "id": "space.navigation.gap",
      "type": "dimension",
      "value": "0.45rem"
    },
    {
      "id": "space.surface.inline",
      "type": "dimension",
      "value": "1rem"
    },
    {
      "id": "space.surface.block",
      "type": "dimension",
      "value": "1rem"
    },
    {
      "id": "space.annotation.inline",
      "type": "dimension",
      "value": "0.55rem"
    },
    {
      "id": "space.annotation.block",
      "type": "dimension",
      "value": "0.15rem"
    },
    {
      "id": "size.control.minimum",
      "type": "dimension",
      "value": "44px"
    },
    {
      "id": "depth.rest.x",
      "type": "dimension",
      "value": "5px"
    },
    {
      "id": "depth.rest.y",
      "type": "dimension",
      "value": "5px"
    },
    {
      "id": "depth.hover.x",
      "type": "dimension",
      "value": "3px"
    },
    {
      "id": "depth.hover.y",
      "type": "dimension",
      "value": "3px"
    },
    {
      "id": "depth.active.x",
      "type": "dimension",
      "value": "0px"
    },
    {
      "id": "depth.active.y",
      "type": "dimension",
      "value": "0px"
    },
    {
      "id": "press.hover.x",
      "type": "dimension",
      "value": "2px"
    },
    {
      "id": "press.hover.y",
      "type": "dimension",
      "value": "2px"
    },
    {
      "id": "press.active.x",
      "type": "dimension",
      "value": "5px"
    },
    {
      "id": "press.active.y",
      "type": "dimension",
      "value": "5px"
    },
    {
      "id": "motion.press.duration",
      "type": "duration",
      "value": "80ms"
    },
    {
      "id": "motion.press.easing",
      "type": "cubicBezier",
      "value": [
        0.2,
        0,
        0,
        1
      ]
    },
    {
      "id": "motion.release.duration",
      "type": "duration",
      "value": "140ms"
    },
    {
      "id": "motion.release.easing",
      "type": "cubicBezier",
      "value": [
        0.2,
        0.9,
        0.3,
        1
      ]
    },
    {
      "id": "motion.standard.duration",
      "type": "duration",
      "value": "160ms"
    },
    {
      "id": "motion.standard.easing",
      "type": "cubicBezier",
      "value": [
        0.2,
        0,
        0,
        1
      ]
    },
    {
      "id": "color.focus.ring",
      "type": "color",
      "value": "#cdbdf7"
    },
    {
      "id": "focus.ring.width",
      "type": "dimension",
      "value": "3px"
    },
    {
      "id": "focus.ring.offset",
      "type": "dimension",
      "value": "3px"
    },
    {
      "id": "font.family.body",
      "type": "fontFamily",
      "value": "ui-sans-serif, system-ui, sans-serif"
    },
    {
      "id": "font.size.body",
      "type": "dimension",
      "value": "1rem"
    },
    {
      "id": "font.size.label",
      "type": "dimension",
      "value": "1rem"
    },
    {
      "id": "font.size.navigation",
      "type": "dimension",
      "value": "clamp(0.72rem, 0.69rem + 0.08vw, 0.78rem)"
    },
    {
      "id": "font.weight.regular",
      "type": "fontWeight",
      "value": 500
    },
    {
      "id": "font.weight.emphasis",
      "type": "fontWeight",
      "value": 750
    },
    {
      "id": "font.weight.strong",
      "type": "fontWeight",
      "value": 800
    },
    {
      "id": "opacity.disabled",
      "type": "number",
      "value": 0.5
    }
  ]
}
